{
  "schemaVersion": 1,
  "blueprintId": "menagerie",
  "revision": "1.0.0",
  "engine": {
    "engineId": "rqe",
    "version": "2.0.0",
    "sourceRoots": [
      "rqe",
      "schemas",
      "apps/studio-plugin",
      "roblox/lib"
    ]
  },
  "projects": [
    {
      "schemaVersion": 1,
      "projectId": "project-menagerie",
      "productId": "menagerie",
      "revision": "1.0.0",
      "seed": 85124202,
      "genre": "collection",
      "templateId": "template-collection-v1",
      "sourceRoot": "games/menagerie",
      "artifactRoot": "artifacts/products/menagerie",
      "productIntentRef": {
        "productId": "menagerie",
        "artifactId": "menagerie.product_intent",
        "kind": "PRODUCT_INTENT",
        "path": "games/menagerie/definition/product-intent.json",
        "sha256": "e61db85dde15ee7ded8a6a72c97dc0b5d186acd54565076d562b3180b67f0c41"
      },
      "referenceBundleRef": {
        "productId": "menagerie",
        "artifactId": "menagerie.reference_bundle",
        "kind": "REFERENCE_BUNDLE",
        "path": "games/menagerie/definition/reference-bundle.json",
        "sha256": "3774d16eac717b22bf8989bb11025ff9f91a2c75e8ad0b7172840fd34a093946"
      },
      "subsystems": [
        {
          "id": "world",
          "capability": "a hub with portals, and one traversable zone per declared zone",
          "dependencies": []
        },
        {
          "id": "interface",
          "capability": "store presence and player-facing screens",
          "dependencies": [
            "world"
          ]
        },
        {
          "id": "telemetry",
          "capability": "analytics",
          "dependencies": [
            "world"
          ]
        },
        {
          "id": "gameplay",
          "capability": "economy, inventory, progression, save",
          "dependencies": [
            "world"
          ]
        }
      ],
      "ownership": [
        {
          "subsystemId": "world",
          "ownerRole": "world-agent",
          "writeRoots": [
            "games/menagerie/src/world"
          ]
        },
        {
          "subsystemId": "interface",
          "ownerRole": "interface-agent",
          "writeRoots": [
            "games/menagerie/src/interface"
          ]
        },
        {
          "subsystemId": "telemetry",
          "ownerRole": "telemetry-agent",
          "writeRoots": [
            "games/menagerie/src/telemetry"
          ]
        },
        {
          "subsystemId": "gameplay",
          "ownerRole": "gameplay-agent",
          "writeRoots": [
            "games/menagerie/src/gameplay"
          ]
        }
      ],
      "deviceViewpointMatrix": {
        "devices": [
          {
            "id": "desktop",
            "viewportWidth": 1920,
            "viewportHeight": 1080,
            "inputModes": [
              "KEYBOARD_MOUSE"
            ]
          },
          {
            "id": "phone",
            "viewportWidth": 390,
            "viewportHeight": 844,
            "inputModes": [
              "TOUCH"
            ]
          }
        ],
        "viewpoints": [
          {
            "id": "overview",
            "purpose": "world readability",
            "cameraMode": "FIXED"
          },
          {
            "id": "player",
            "purpose": "core interaction",
            "cameraMode": "PLAYER"
          }
        ],
        "combinations": [
          {
            "deviceId": "desktop",
            "viewpointId": "overview"
          },
          {
            "deviceId": "desktop",
            "viewpointId": "player"
          },
          {
            "deviceId": "phone",
            "viewpointId": "overview"
          },
          {
            "deviceId": "phone",
            "viewpointId": "player"
          }
        ]
      },
      "scenarioClasses": [
        {
          "id": "first-session",
          "class": "ONBOARDING",
          "requiredForRelease": true,
          "actorProfile": "new-player"
        },
        {
          "id": "core-loop",
          "class": "CORE_LOOP",
          "requiredForRelease": true,
          "actorProfile": "returning-player"
        },
        {
          "id": "progression",
          "class": "PROGRESSION",
          "requiredForRelease": true,
          "actorProfile": "returning-player"
        }
      ],
      "assetNeeds": [
        {
          "id": "experience-icon",
          "type": "ICON",
          "strategy": "EITHER",
          "requiredForRelease": true,
          "consumers": [
            "interface"
          ],
          "acceptanceProfileId": "release-quality"
        },
        {
          "id": "experience-thumbnail",
          "type": "IMAGE",
          "strategy": "EITHER",
          "requiredForRelease": true,
          "consumers": [
            "interface"
          ],
          "acceptanceProfileId": "release-quality"
        },
        {
          "id": "zone-start-kit",
          "type": "MODEL",
          "strategy": "CREATE",
          "requiredForRelease": true,
          "consumers": [
            "world"
          ],
          "acceptanceProfileId": "release-quality"
        },
        {
          "id": "zone-deep-kit",
          "type": "MODEL",
          "strategy": "CREATE",
          "requiredForRelease": true,
          "consumers": [
            "world"
          ],
          "acceptanceProfileId": "release-quality"
        }
      ],
      "qualityProfiles": [
        {
          "id": "release-quality",
          "requiredForRelease": true,
          "appliesTo": [
            "GAMEPLAY",
            "VISUAL",
            "ASSETS",
            "RELEASE"
          ],
          "inputRef": {
            "productId": "menagerie",
            "artifactId": "menagerie.quality_profile",
            "kind": "QUALITY_PROFILE",
            "path": "games/menagerie/definition/release-quality.json",
            "sha256": "2ee439e13341bde627560adf4ad239bb01c52d2e39561ad6f6453d3fd1dcbda7"
          }
        }
      ],
      "outputArtifactRefs": [
        {
          "productId": "menagerie",
          "artifactId": "menagerie.production_plan",
          "kind": "PRODUCTION_PLAN",
          "path": "artifacts/products/menagerie/production_plan"
        },
        {
          "productId": "menagerie",
          "artifactId": "menagerie.source_bundle",
          "kind": "SOURCE_BUNDLE",
          "path": "artifacts/products/menagerie/source_bundle"
        },
        {
          "productId": "menagerie",
          "artifactId": "menagerie.asset_manifest",
          "kind": "ASSET_MANIFEST",
          "path": "artifacts/products/menagerie/asset_manifest"
        },
        {
          "productId": "menagerie",
          "artifactId": "menagerie.build_place",
          "kind": "BUILD_PLACE",
          "path": "artifacts/products/menagerie/build_place"
        },
        {
          "productId": "menagerie",
          "artifactId": "menagerie.integration_manifest",
          "kind": "INTEGRATION_MANIFEST",
          "path": "artifacts/products/menagerie/integration_manifest"
        },
        {
          "productId": "menagerie",
          "artifactId": "menagerie.measurement_run",
          "kind": "MEASUREMENT_RUN",
          "path": "artifacts/products/menagerie/measurement_run"
        },
        {
          "productId": "menagerie",
          "artifactId": "menagerie.scenario_results",
          "kind": "SCENARIO_RESULTS",
          "path": "artifacts/products/menagerie/scenario_results"
        },
        {
          "productId": "menagerie",
          "artifactId": "menagerie.capture_bundle",
          "kind": "CAPTURE_BUNDLE",
          "path": "artifacts/products/menagerie/capture_bundle"
        },
        {
          "productId": "menagerie",
          "artifactId": "menagerie.quality_review",
          "kind": "QUALITY_REVIEW",
          "path": "artifacts/products/menagerie/quality_review"
        },
        {
          "productId": "menagerie",
          "artifactId": "menagerie.repair_plan",
          "kind": "REPAIR_PLAN",
          "path": "artifacts/products/menagerie/repair_plan"
        },
        {
          "productId": "menagerie",
          "artifactId": "menagerie.regression_run",
          "kind": "REGRESSION_RUN",
          "path": "artifacts/products/menagerie/regression_run"
        },
        {
          "productId": "menagerie",
          "artifactId": "menagerie.release_candidate",
          "kind": "RELEASE_CANDIDATE",
          "path": "artifacts/products/menagerie/release_candidate"
        }
      ]
    }
  ]
}
