{
  "schemaVersion": 1,
  "blueprintId": "neondrift",
  "revision": "1.0.0",
  "engine": {
    "engineId": "rqe",
    "version": "2.0.0",
    "sourceRoots": [
      "rqe",
      "schemas",
      "apps/studio-plugin",
      "roblox/lib"
    ]
  },
  "projects": [
    {
      "schemaVersion": 1,
      "projectId": "project-neondrift",
      "productId": "neondrift",
      "revision": "1.0.0",
      "seed": 84184295,
      "genre": "racing",
      "templateId": "template-racing-v1",
      "sourceRoot": "games/neondrift",
      "artifactRoot": "artifacts/products/neondrift",
      "productIntentRef": {
        "productId": "neondrift",
        "artifactId": "neondrift.product_intent",
        "kind": "PRODUCT_INTENT",
        "path": "games/neondrift/definition/product-intent.json",
        "sha256": "ce71ff1765366cf1d601a624970af146db682974d1098643a89afba9ee98daa8"
      },
      "referenceBundleRef": {
        "productId": "neondrift",
        "artifactId": "neondrift.reference_bundle",
        "kind": "REFERENCE_BUNDLE",
        "path": "games/neondrift/definition/reference-bundle.json",
        "sha256": "e397caef37439c9d43a371fcdf2aff6b3d162dcb6991cc450ba66c43fe2732c5"
      },
      "subsystems": [
        {
          "id": "world",
          "capability": "a sequence of gated level volumes",
          "dependencies": []
        },
        {
          "id": "interface",
          "capability": "store presence and player-facing screens",
          "dependencies": [
            "world"
          ]
        },
        {
          "id": "telemetry",
          "capability": "analytics",
          "dependencies": [
            "world"
          ]
        },
        {
          "id": "gameplay",
          "capability": "economy, progression, save",
          "dependencies": [
            "world"
          ]
        }
      ],
      "ownership": [
        {
          "subsystemId": "world",
          "ownerRole": "world-agent",
          "writeRoots": [
            "games/neondrift/src/world"
          ]
        },
        {
          "subsystemId": "interface",
          "ownerRole": "interface-agent",
          "writeRoots": [
            "games/neondrift/src/interface"
          ]
        },
        {
          "subsystemId": "telemetry",
          "ownerRole": "telemetry-agent",
          "writeRoots": [
            "games/neondrift/src/telemetry"
          ]
        },
        {
          "subsystemId": "gameplay",
          "ownerRole": "gameplay-agent",
          "writeRoots": [
            "games/neondrift/src/gameplay"
          ]
        }
      ],
      "deviceViewpointMatrix": {
        "devices": [
          {
            "id": "desktop",
            "viewportWidth": 1920,
            "viewportHeight": 1080,
            "inputModes": [
              "KEYBOARD_MOUSE"
            ]
          },
          {
            "id": "phone",
            "viewportWidth": 390,
            "viewportHeight": 844,
            "inputModes": [
              "TOUCH"
            ]
          }
        ],
        "viewpoints": [
          {
            "id": "overview",
            "purpose": "world readability",
            "cameraMode": "FIXED"
          },
          {
            "id": "player",
            "purpose": "core interaction",
            "cameraMode": "PLAYER"
          }
        ],
        "combinations": [
          {
            "deviceId": "desktop",
            "viewpointId": "overview"
          },
          {
            "deviceId": "desktop",
            "viewpointId": "player"
          },
          {
            "deviceId": "phone",
            "viewpointId": "overview"
          },
          {
            "deviceId": "phone",
            "viewpointId": "player"
          }
        ]
      },
      "scenarioClasses": [
        {
          "id": "first-session",
          "class": "ONBOARDING",
          "requiredForRelease": true,
          "actorProfile": "new-player"
        },
        {
          "id": "race",
          "class": "CORE_LOOP",
          "requiredForRelease": true,
          "actorProfile": "returning-player"
        },
        {
          "id": "progression",
          "class": "PROGRESSION",
          "requiredForRelease": true,
          "actorProfile": "returning-player"
        }
      ],
      "assetNeeds": [
        {
          "id": "experience-icon",
          "type": "ICON",
          "strategy": "EITHER",
          "requiredForRelease": true,
          "consumers": [
            "interface"
          ],
          "acceptanceProfileId": "release-quality"
        },
        {
          "id": "experience-thumbnail",
          "type": "IMAGE",
          "strategy": "EITHER",
          "requiredForRelease": true,
          "consumers": [
            "interface"
          ],
          "acceptanceProfileId": "release-quality"
        },
        {
          "id": "storefront-art",
          "type": "IMAGE",
          "strategy": "EITHER",
          "requiredForRelease": true,
          "consumers": [
            "interface"
          ],
          "acceptanceProfileId": "release-quality"
        }
      ],
      "qualityProfiles": [
        {
          "id": "release-quality",
          "requiredForRelease": true,
          "appliesTo": [
            "GAMEPLAY",
            "VISUAL",
            "ASSETS",
            "RELEASE"
          ],
          "inputRef": {
            "productId": "neondrift",
            "artifactId": "neondrift.quality_profile",
            "kind": "QUALITY_PROFILE",
            "path": "games/neondrift/definition/release-quality.json",
            "sha256": "2cc35bef24319dd65cfb071a4abed48943b15ea05a8e1412f26c36a22b7c8db7"
          }
        }
      ],
      "outputArtifactRefs": [
        {
          "productId": "neondrift",
          "artifactId": "neondrift.production_plan",
          "kind": "PRODUCTION_PLAN",
          "path": "artifacts/products/neondrift/production_plan"
        },
        {
          "productId": "neondrift",
          "artifactId": "neondrift.source_bundle",
          "kind": "SOURCE_BUNDLE",
          "path": "artifacts/products/neondrift/source_bundle"
        },
        {
          "productId": "neondrift",
          "artifactId": "neondrift.asset_manifest",
          "kind": "ASSET_MANIFEST",
          "path": "artifacts/products/neondrift/asset_manifest"
        },
        {
          "productId": "neondrift",
          "artifactId": "neondrift.build_place",
          "kind": "BUILD_PLACE",
          "path": "artifacts/products/neondrift/build_place"
        },
        {
          "productId": "neondrift",
          "artifactId": "neondrift.integration_manifest",
          "kind": "INTEGRATION_MANIFEST",
          "path": "artifacts/products/neondrift/integration_manifest"
        },
        {
          "productId": "neondrift",
          "artifactId": "neondrift.measurement_run",
          "kind": "MEASUREMENT_RUN",
          "path": "artifacts/products/neondrift/measurement_run"
        },
        {
          "productId": "neondrift",
          "artifactId": "neondrift.scenario_results",
          "kind": "SCENARIO_RESULTS",
          "path": "artifacts/products/neondrift/scenario_results"
        },
        {
          "productId": "neondrift",
          "artifactId": "neondrift.capture_bundle",
          "kind": "CAPTURE_BUNDLE",
          "path": "artifacts/products/neondrift/capture_bundle"
        },
        {
          "productId": "neondrift",
          "artifactId": "neondrift.quality_review",
          "kind": "QUALITY_REVIEW",
          "path": "artifacts/products/neondrift/quality_review"
        },
        {
          "productId": "neondrift",
          "artifactId": "neondrift.repair_plan",
          "kind": "REPAIR_PLAN",
          "path": "artifacts/products/neondrift/repair_plan"
        },
        {
          "productId": "neondrift",
          "artifactId": "neondrift.regression_run",
          "kind": "REGRESSION_RUN",
          "path": "artifacts/products/neondrift/regression_run"
        },
        {
          "productId": "neondrift",
          "artifactId": "neondrift.release_candidate",
          "kind": "RELEASE_CANDIDATE",
          "path": "artifacts/products/neondrift/release_candidate"
        }
      ]
    }
  ]
}
